{
  "activation": "inert",
  "catalog_version": "0.1.0",
  "content_sha256": "33525083a1fab44fdd3d7fc92107077e06fb5540fde2c5a5d7c6f4869197cac2",
  "count": 5,
  "kind": "mcp_lane_catalog",
  "lifecycle_state": "inert",
  "records": [
    {
      "activation": "inert",
      "asset_id": "mcp.lane.context-assets",
      "binds_stdio_compat_tools": true,
      "compatibility": "orchestrator>=0.1.0",
      "content_sha256": "dcc22fc8f29061fead19386bbf156af21cf249c797fcca40c0aa6b2022b6ecc5",
      "executable": false,
      "forbidden_operations": [
        "waiver",
        "hitm_exception",
        "paid_retry_after_unknown",
        "merge",
        "deploy",
        "publication",
        "schedule_activation",
        "arbitrary_script_execution",
        "policy_profile_activation",
        "credential_projection",
        "unrestricted_state_mutation",
        "direct_database_access",
        "provider_cli_invocation"
      ],
      "kind": "mcp_lane_profile",
      "lane_id": "context-assets",
      "lifecycle_state": "inert",
      "notes": "Also binds the existing five read-only stdio MCP tools.",
      "owner": "platform.orchestrator",
      "provenance": "r1-design-contract",
      "sensitivity": "public",
      "source": "agentic/catalogs/mcp_lanes.json",
      "stdio_compat_tools": [
        "repo_health",
        "open_prs",
        "ci_status",
        "work_lookup",
        "session_brief"
      ],
      "tools": [
        "bounded_packets",
        "catalog_search_get",
        "loadout_resolution",
        "repo_ci_pr_reads",
        "repo_health",
        "open_prs",
        "ci_status",
        "work_lookup",
        "session_brief"
      ],
      "version": "0.1.0"
    },
    {
      "activation": "inert",
      "asset_id": "mcp.lane.delegation-coordination",
      "binds_stdio_compat_tools": false,
      "compatibility": "orchestrator>=0.1.0",
      "content_sha256": "f7599023f20418c8a860d198d7a4ace641881fdf07ef21b3011d4dd909f5b1fe",
      "executable": false,
      "forbidden_operations": [
        "waiver",
        "hitm_exception",
        "paid_retry_after_unknown",
        "merge",
        "deploy",
        "publication",
        "schedule_activation",
        "arbitrary_script_execution",
        "policy_profile_activation",
        "credential_projection",
        "unrestricted_state_mutation",
        "direct_database_access",
        "provider_cli_invocation"
      ],
      "kind": "mcp_lane_profile",
      "lane_id": "delegation-coordination",
      "lifecycle_state": "inert",
      "notes": "",
      "owner": "platform.orchestrator",
      "provenance": "r1-design-contract",
      "sensitivity": "public",
      "source": "agentic/catalogs/mcp_lanes.json",
      "tools": [
        "org_profile_read",
        "loadout_preview",
        "assignment",
        "request",
        "disposition",
        "dispatch",
        "handoff"
      ],
      "version": "0.1.0"
    },
    {
      "activation": "inert",
      "asset_id": "mcp.lane.evidence-governance",
      "binds_stdio_compat_tools": false,
      "compatibility": "orchestrator>=0.1.0",
      "content_sha256": "76333c8b648629f4d88248714489a9ef719709fc489886dc3176a5099831d69f",
      "executable": false,
      "forbidden_operations": [
        "waiver",
        "hitm_exception",
        "paid_retry_after_unknown",
        "merge",
        "deploy",
        "publication",
        "schedule_activation",
        "arbitrary_script_execution",
        "policy_profile_activation",
        "credential_projection",
        "unrestricted_state_mutation",
        "direct_database_access",
        "provider_cli_invocation"
      ],
      "kind": "mcp_lane_profile",
      "lane_id": "evidence-governance",
      "lifecycle_state": "inert",
      "notes": "",
      "owner": "platform.orchestrator",
      "provenance": "r1-design-contract",
      "sensitivity": "public",
      "source": "agentic/catalogs/mcp_lanes.json",
      "tools": [
        "artifacts",
        "findings_anomalies",
        "reports",
        "review_acceptance",
        "escalation",
        "policy_explanation",
        "ordinary_authorized_gate_actions"
      ],
      "version": "0.1.0"
    },
    {
      "activation": "inert",
      "asset_id": "mcp.lane.maintenance",
      "binds_stdio_compat_tools": false,
      "compatibility": "orchestrator>=0.1.0",
      "content_sha256": "7afd9e28d3ac3e55e9fe8935bee181cc9ae03d55641d591586c4bfc9013513e5",
      "executable": false,
      "forbidden_operations": [
        "waiver",
        "hitm_exception",
        "paid_retry_after_unknown",
        "merge",
        "deploy",
        "publication",
        "schedule_activation",
        "arbitrary_script_execution",
        "policy_profile_activation",
        "credential_projection",
        "unrestricted_state_mutation",
        "direct_database_access",
        "provider_cli_invocation"
      ],
      "kind": "mcp_lane_profile",
      "lane_id": "maintenance",
      "lifecycle_state": "inert",
      "notes": "",
      "owner": "platform.orchestrator",
      "provenance": "r1-design-contract",
      "sensitivity": "public",
      "source": "agentic/catalogs/mcp_lanes.json",
      "tools": [
        "schedule_status_run",
        "registered_check_execution",
        "maintenance_evidence",
        "health",
        "recovery_test_results"
      ],
      "version": "0.1.0"
    },
    {
      "activation": "inert",
      "asset_id": "mcp.lane.workflow-control",
      "binds_stdio_compat_tools": false,
      "compatibility": "orchestrator>=0.1.0",
      "content_sha256": "32ebb2651aa9d227ea871da491a28d85c007d8972e5eeabb060a060c2bcfc595",
      "executable": false,
      "forbidden_operations": [
        "waiver",
        "hitm_exception",
        "paid_retry_after_unknown",
        "merge",
        "deploy",
        "publication",
        "schedule_activation",
        "arbitrary_script_execution",
        "policy_profile_activation",
        "credential_projection",
        "unrestricted_state_mutation",
        "direct_database_access",
        "provider_cli_invocation"
      ],
      "kind": "mcp_lane_profile",
      "lane_id": "workflow-control",
      "lifecycle_state": "inert",
      "notes": "Design-only lane profile; calls DRF only in later milestones.",
      "owner": "platform.orchestrator",
      "provenance": "r1-design-contract",
      "sensitivity": "public",
      "source": "agentic/catalogs/mcp_lanes.json",
      "tools": [
        "work_status",
        "queue_status",
        "dependency_status",
        "gate_status",
        "budget_status",
        "preview",
        "step",
        "run",
        "pause",
        "resume",
        "cancel",
        "reconcile"
      ],
      "version": "0.1.0"
    }
  ],
  "schema_version": 1,
  "stdio_compat_tools_bound_into": "mcp.lane.context-assets"
}
